{"acquisition_overhead":{"reason":"missing_board_or_source_identical_firmware","status":"not_evaluated"},"benchmark_evidence_version":"p7.6-benchmark-v1","claim_strength":"report_only","environment":{},"environment_identity":"ca3d163bab055381827226140568f3bef7eaac187cebd76878e0b63e9e442356","hardware_validation":false,"samples":[],"summaries":[]}
